Publication_Number,Title,Abstract,Inventors,Publication_Date,PDF_Link,resource
US20190339685A1,"Methods and systems for data collection, learning, and streaming of machine signals for analytics and maintenance using the industrial internet of things","A system generally includes a sensor detecting a condition of an industrial machine, the sensor producing a signal that varies over time and substantially corresponds with the condition; an analog to digital converter that receives the signal and samples the signal at a streaming sample rate that is at least twice a dominant frequency of the signal, the sampled signal being output from the analog to digital converter as a sequence of data values; and at least one digital signal router that receives the sequence of data value and a sub-sampling rate, wherein the sub-sampling rate is lower than the streaming sample rate, and produces at least one sub-sampled output sequence of data comprising select samples from the sequence of samples based on at least one of the sub-sampling rate and a ratio of the streaming sample rate and the sub-sampling rate.","Gerald William Duffy, JR.",2019-11-07,https://patentimages.storage.googleapis.com/31/e6/29/881eba23426c56/US20190339685A1.pdf,google patents
US10991463B2,"Computer-implemented system and methods for predicting the health and therapeutic behavior of individuals using artificial intelligence, smart contracts and blockchain",A computer implemented method of predicting the health and therapeutic behavior of patients and making treatment plan recommendations includes the steps of: receiving patient healthcare data having one or more conditions and limiting factors; determining a therapeutic behavior pattern of patient; determining unsuccessful therapies and successful therapies for each condition based on therapeutic behavior pattern; and calculating cost quote for successful therapies based on limiting factors for time period. A computer implemented method of providing cost effective therapy for a patient is also provided and includes the steps of: receiving patient healthcare data; determining unsuccessful therapies and successful therapies; calculating probability of disease progression; calculating possible therapies ranked by probability of successful treatment; calculate cost quote for possible therapies; and paying a smart contract for a selected therapy.,Wayne C. A. Wright,2020-08-27,https://patentimages.storage.googleapis.com/8b/5f/92/58fd6949c1ef12/US10991463.pdf,google patents
US20220375619A1,"System, methods, and apparatuses for managing data for artificial intelligence software and mobile applications in digital health therapeutics","Disclosed herein are systems and methods of a digital therapy service to generate therapy regimen addressing a health condition, which may require the customer to perform various tasks and instruct devices to capture data related to the customer's therapy, including body metric measurements and information related to the number and quality of interactions between the user and aspects of the digital therapy service, sometimes referred to as “user-generated” inputs. The digital therapy service may calculate various metrics, such as scores and milestone determinations, to measure the customer's progress. The scores can be determined using dynamically generated and updated scoring models. Artificial intelligence chatbots may be used to deliver and capture information to and from customers during interactive sessions. Each customer may have a unique chatbot queue that contains the various chatbots that will be used to deliver particular aspects of the customer's therapy.",Mark Berman,2022-11-24,https://patentimages.storage.googleapis.com/61/5c/94/f2b805720bcfb5/US20220375619A1.pdf,google patents
KR102188766B1,Apparatus for providing artificial intelligence based health care service,"The present invention relates to an artificial intelligence-based healthcare service providing apparatus. According to the present invention, the apparatus comprises: a user health information management unit which receives user health information including user information input from a user and user state information including at least one biometric information measured; a user exercise information management unit for receiving user exercise information obtained by measuring the amount of exercise of a user; an external environmental information management unit which collects environmental harmful information outside the user according to a current location of the user; an information analysis processing unit which analyzes the user health information, the user exercise information, and the environmental harmful information to predict a disease that may develop in the user; and a healthcare service providing unit which guides the improvement of the user′s disease by presenting a healthcare role model to the user according to the predicted disease of the user, and providing the role model′s eating habits and exercise habits.",,2020-12-11,https://patentimages.storage.googleapis.com/6e/24/57/6a1c27e4bd6a07/KR102188766B1.pdf,google patents
KR101964733B1,"Personalized health care system based on block chain and artificial intelligence, and method for providing personalized health care service based on block chain and artificial intelligence using the same","According to the present invention, provided is a personalized health care service providing method based on a block chain and artificial intelligence. The method comprises the following steps. Health-related data of a user is encrypted, the encrypted health-related data is blocked to form a chain, and the blocked data is stored in a block chain. A health prediction artificial intelligence server analyzes and tracks the health status change of the user through a big data analysis of the health-related data. And, the health prediction artificial intelligence server derives a preventive measure for preventing the expected disease from the analysis and the prediction result.",,2019-04-02,https://patentimages.storage.googleapis.com/db/52/4e/611d9a3b56e8c0/KR101964733B1.pdf,google patents
US11883153B2,Digital platform to identify health conditions and therapeutic interventions using an automatic and distributed artificial intelligence system,"This disclosure is directed to method and system for automatic, distributed, computer-aided, and intelligent data collection/analytics, health monitoring, health condition identification, and patient preventive/remedial health advocacy. The system integrates (1) distributed patient health data collection devices, (2) centralized or distributed data servers running various intelligent and predictive data analytics engines for health screening, assessment, patient health condition identification, and patient preventive/remedial health advocacy, 3) specifically designed data structures including quantized health indicator vectors, patient health condition identification matrices and patient health condition vectors, (4) portal servers configured to interface with (5) distributed physician terminal devices and (6) distributed patient terminal devices for delivering health condition identification, health interventions and patient preventive/remedial health advocacy, and for monitoring and tracking patient activities. The various intelligent and predictive engines are configured to learn and extract hidden features and correlations from a large amount of data obtained from the distributed data collection devices.",Stephen Moxey,2021-03-25,https://patentimages.storage.googleapis.com/e6/d6/d1/0d8fcf79bc940c/US11883153.pdf,google patents
AU2020264390B2,Enhancing diagnosis of disorder through artificial intelligence and mobile health technologies without compromising accuracy,"A computer system for generating a diagnostic tool by applying artificial intelligence 
to an instrument for diagnosis of a disorder, such as autism. For autism, the 
instrument can be a caregiver-directed set of questions designed for an autism 
classification tool or an observation of the subject in a video, video conference, or in 
person and associated set of questions about behaviour that are designed for use in a 
separate autism classification tool. The computer system can have one or more 
processors and memory to store one or more computer programs having instructions 
for generating a highly statistically accurate set of diagnostic items selected from the 
instrument, which are tested against a first test using a technique using artificial 
intelligence and a second test against an independent source. Also, a computer 
implemented method and a non-transitory computer-readable storage medium are 
disclosed.
WO 2013/062937 PCT/US2012/061422 
1/35 
ALTERNATING DECISION TREE (ADTree) 
99.9%ACCURACY 
AUTISM VS. NOT MET 
AD~ree LAD~ree NNge 148graft
ordinal Class 
*Classifier & J48 
+JRip 
11 
0.95------------- *PART * *OneR _ 
+ RSimplecart 
FilteredClassifier 
+BFTree 
0.99
+CoajunctiveRulo 
0 0.05 0.1 0.15 01 
(.00-SPEcIFCITY) 
FIG. 1 
SUBSTITUTE SHEET (RULE 26)",,2020-12-10,https://patentimages.storage.googleapis.com/a9/da/9d/af8f3e71a13c9d/AU2020264390B2.pdf,google patents
US20220130277A1,Artificial intelligence based health coaching based on breath analyte levels of participants,"A system is disclosed that uses profiles of users, including monitored ketone levels of the users, to assess effectiveness levels of health programs (such as weight loss programs) assigned to the users, and to select health program modifications for the users. The system may use a machine learning (artificial intelligence) algorithm to adaptively learn how to classify users and to select messaging and behavioral modifications for the users. For example, in some embodiments the system classifies the users and provides associated health program recommendations using a computer model trained with expert-classified user data records. As another example, a set of rules may be used to generate the health program recommendations and related messaging, and the set of rules may automatically be modified over time based on feedback data reflective of health program effectiveness levels produced by such rules. In some embodiments the system includes a mobile application that runs on mobile devices of users and communicates wirelessly with breath analysis devices of the users. The mobile application may also communicate with a server-based system that generates the health program recommendations.",Salman A. Ahmad,2022-04-28,https://patentimages.storage.googleapis.com/70/35/0c/b2574a8e2e78d2/US20220130277A1.pdf,google patents
US10089203B2,Artificial intelligence based health management of host system,"This disclosure relates generally to health management, and more particularly to a method and system for artificial intelligence based diagnostic and prognostic health management of host systems. In an embodiment, the system includes a memory to store instructions, and a neural network controller coupled to the memory. The neural network controller is configured by the instructions to monitor a plurality of unique patterns generated in real-time. The plurality of system parameters is indicative of a system-level performance of the host system. The neural network controller is configured by the instructions to compare the plurality of unique patterns with a plurality of predetermined patterns corresponding to the plurality of system parameters to detect potential anomalies in the host system and one or more subsystems of the plurality of subsystems, where the one or more subsystems are responsible for contributing to the potential anomalies in the host system.",Pallanti Srinivasa RAO,2016-12-01,https://patentimages.storage.googleapis.com/ba/7b/80/1695e5fdbf533a/US10089203.pdf,google patents
KR102224188B1,System and method for providing health care contents for virtual reality using cloud based artificial intelligence,"According to one embodiment of the present invention, provided is a cloud-based healthcare content providing system, which comprises: at least one user computer; at least one administrator computer; and a cloud server which mediates data transmission/reception between the at least one user computer and the at least one administrator computer. The user computer generates exercise record data based on the user′s bio-signals measured using a bio-signal sensor and the number of revolutions per hour of indoor exercise equipment measured using the rotation sensor. The exercise record data may be transmitted to the manager computer through the cloud server, and customized healthcare data may be received from the manager computer and output together with the exercise record data on a display. According to one embodiment, the user may be provided with customized healthcare content according to the result of analyzing the exercise record data, and it is possible to conduct cooperative or competitive exercise programs with other users connected through the network.",,2021-03-08,https://patentimages.storage.googleapis.com/6c/5d/30/35e98cc3391367/KR102224188B1.pdf,google patents
KR102120828B1,Apparatus for monitoring health based on virtual reality using Artificial Intelligence and method thereof,"The present invention relates to a health monitoring apparatus based on virtual reality using artificial intelligence, and to a method thereof. The health monitoring apparatus of the present invention recognizes the user′s motion through a sensor unit, provides the recognized user′s motion through virtual reality, and analyzes the recognized user′s motion through artificial intelligence to provide a feedback according to an analysis result, thereby being possible to perform a fitness lesson at a time and place desired by a user, increasing user satisfaction dye to a direct feedback and field lessons in a virtual reality space, and increasing immersion in exercise.",,2020-06-09,https://patentimages.storage.googleapis.com/20/77/9a/5960bdcb113ff6/KR102120828B1.pdf,google patents
US20230359910A1,Artificial intelligence and/or virtual reality for activity optimization/personalization,Optimizing and/or personalizing activities to a user through artificial intelligence and/or virtual reality.,Justin E. Beyers,2023-11-09,https://patentimages.storage.googleapis.com/f4/bd/70/ecc49c4cca1ccb/US20230359910A1.pdf,google patents
US20230260048A1,Implementing Machine Learning For Life And Health Insurance Claims Handling,"Techniques for implementing machine learning to improve claim handling are disclosed. In some scenarios, the machine-learning, analytics model may be trained in accordance with data that is relevant to insurance products, such as life and health insurance. A set of labeled historical claims each corresponding to a settlement amount may be analyzed to train an artificial neural network, A claim may be received from a user mobile device, and may be analyzed using the trained artificial neural network to predict a claim settlement, which may be used to generate a settlement offer. The settlement offer may be transmitted to the user's mobile device, and if a manifestation of acceptance is received from the user, then the claim may be automatically paid.",Meghan Sims Goldfarb,2023-08-17,https://patentimages.storage.googleapis.com/32/63/91/807631712d10f9/US20230260048A1.pdf,google patents
US11839444B2,Ceiling AI health monitoring apparatus and remote medical-diagnosis method using the same,"A ceiling artificial intelligence (AI) health monitoring system, includes a monitoring device provided on a ceiling of a space to acquire health information from a patient, and a medical management device configured to apply the health information of the patient acquired to an artificial intelligence-based learning model to determine health condition information of the patient and provide the determination result to a doctor monitor. The medical management device is configured to provide remote medical diagnosis information from the doctor monitor to a user terminal.",,2022-02-17,https://patentimages.storage.googleapis.com/87/5b/e7/45966cd0f4b9d2/US11839444.pdf,google patents
US20210118559A1,Artificial intelligence assisted precision medicine enhancements to standardized laboratory diagnostic testing,"A system and method, the method comprising receiving a laboratory diagnostic testing result associated with a specimen of a subject, the steps of receiving a clinomic profile of the subject, identifying a cohort of similar subjects based at least in part on the clinomic profile of the subject, providing the diagnostic testing results, clinomic profile, and the cohort of similar subjects to a smart output module to generate a personalized, precision medicine based laboratory diagnostic testing result as a smart output and displaying the smart output to a user.",,2021-04-22,https://patentimages.storage.googleapis.com/bf/47/8e/28761a09e49701/US20210118559A1.pdf,google patents
US20200302296A1,Systems and method for optimizing educational outcomes using artificial intelligence,"The present invention is directed, in one particular implementation, to a cloud computing-based categorization system that comprises at least one electronic database having one or more performance assessment data associated with a plurality of entities matriculated at one or more educational institutions. The system further includes a processor, communicatively coupled to the at least one database, and configured to execute an electronic process that analyzes and converts said performance assessment data. Through one or more modules, the processor is configured to select performance assessment data corresponding to at least one structured assessment data value; and at least one unstructured assessment data set for an individual and evaluate the structured and un-structed data of the individual using an assessment model configured to classify the entity into one of a plurality of assessment categories. The processor is further configured by one or more modules to generate a graphical representation, for display and output to one or more remote users, of the likelihood that the individual is assigned to one of the plurality of assessment categories.",,2020-09-24,https://patentimages.storage.googleapis.com/e9/3d/95/6b603c6bd72e5d/US20200302296A1.pdf,google patents
US20210210207A1,Simulation of health states and need for future medical services,"Systems and methods are provided for simulating a patient health state by determining one or more relationships within patient data, creating enriched data elements based on the determined relationships, and using a machine learning module to simulate a future health state of the patient and predict a future medical service need.",Charles J. Clarke,2021-07-08,https://patentimages.storage.googleapis.com/ee/ad/8c/503c2a26b6acf7/US20210210207A1.pdf,google patents
US20210202103A1,Modeling and simulation of current and future health states,"Systems and methods are provided for simulating a patient health state by determining one or more relationships between patient data and historical data, creating enriched data elements based on the determined relationships, and using a machine learning module to compute a current health state for a patient and to simulate a future health state of the patient.",Charles J. Clarke,2021-07-01,https://patentimages.storage.googleapis.com/dd/3d/f6/b5dd3855640aa1/US20210202103A1.pdf,google patents
CN110522983B,"Brain stimulation system, method, device and storage medium based on artificial intelligence","The embodiment of the invention discloses an artificial intelligence-based brain stimulation system, an artificial intelligence-based brain stimulation method, an artificial intelligence-based brain stimulation device and a storage medium. The system comprises: a plurality of brain stimulation terminals and a cloud platform; the cloud platform is used for generating multidimensional psychological big data by learning physiological data and psychological state evaluation parameters from a plurality of brain stimulation terminals and combining a preset diagnosis and treatment model of various diseases by adopting an artificial intelligence technology; the brain stimulation terminal is used for analyzing the acquired physiological data and psychological state evaluation parameters of the target object by adopting an artificial intelligence technology based on the multidimensional psychological big data, determining the mental state of the target object, obtaining brain stimulation parameters required by the target object according to the mental state, and generating corresponding noninvasive brain stimulation for the target object according to the brain stimulation parameters. The embodiment of the invention is suitable for common people to maintain mental health and regulate bad emotion, and has the effects of early prediction, professional prevention and timely intervention on some serious mental diseases.",,2019-12-03,https://patentimages.storage.googleapis.com/c1/b4/29/a339e160a68612/CN110522983B.pdf,google patents
US20180137247A1,Preventive and predictive health platform,"A preventive and predictive healthcare platform is provided. This preventive and predictive healthcare platform includes a computer server connected to an electronic communication network. The server has a democratized data store that is owned by the platform user and acts as the single repository of all health information for the platform user (vital signs, medication, wellness profiles, etc.). This data store may be enabled on mobile devices such as smart phones and tablet computers. The server is configured to send and receive healthcare data to healthcare data providers, to process the healthcare data, and to transmit at least some of the healthcare data to one or more users. The preventive and predictive healthcare platform also has an artificial intelligence engine that includes a machine-based learning algorithm which provides a predictive and preventative care model for a platform user.",Sanjay Mohan,2018-05-17,https://patentimages.storage.googleapis.com/5f/e8/bb/42510831127628/US20180137247A1.pdf,google patents
US10559386B1,Methods and systems for an artificial intelligence support network for vibrant constituional guidance,"A system for an artificial intelligence support network for vibrant constitutional guidance includes a diagnostic engine operating on at least a server and configured to receive at least a biological extraction from a user and generate a diagnostic output based on the at least a biological extraction. The system includes at least an advisor module configured to receive at least a request for an advisory input, generate at least an advisory output using the at least a request for an advisory input and at least a diagnostic output, select at least an informed advisor as a function of the at least a request for an advisory input, and transmit the at least an advisor output to the at least a selected informed advisor.",,2020-02-11,https://patentimages.storage.googleapis.com/13/cd/e1/7305a5d61ebd7e/US10559386.pdf,google patents
US10282512B2,Clinical decision-making artificial intelligence object oriented system and method,"The present invention involves a system and method of providing decision support for assisting medical treatment decision-making. A patient agent software module processes information about a particular patient. A doctor agent software module processes information about a health status of a particular patient, beliefs relating to patient treatments, and the actual effects of treatment decisions. By filtering information over time from the patient agent into the doctor agent, a plurality of decision-outcome nodes are created and formed into a patient-specific outcome tree with the plurality of decision-outcome nodes. An optimal treatment is determined by evaluating the plurality of decision-outcome nodes with a cost per unit change function to output the optimal treatment. When additional information is available from at least one of the patient agent and the doctor agent, the filtering, creating, and determining steps are repeated thus allowing for the system to “reason over time”, continuously updating and learning as new information is received.",Kris Hauser,2015-01-15,https://patentimages.storage.googleapis.com/6b/4b/0f/7f5c13ebfd7f12/US10282512.pdf,google patents
US10755816B2,Clinical decision-making artificial intelligence object oriented system and method,"The present invention involves a system and method of providing decision support for assisting medical treatment decision-making. A patient agent software module processes information about a particular patient. A doctor agent software module processes information about a health status of a particular patient, beliefs relating to patient treatments, and the actual effects of treatment decisions. By filtering information over time from the patient agent into the doctor agent, a plurality of decision-outcome nodes are created and formed into a patient-specific outcome tree with the plurality of decision-outcome nodes. An optimal treatment is determined by evaluating the plurality of decision-outcome nodes with a cost per unit change function to output the optimal treatment. When additional information is available from at least one of the patient agent and the doctor agent, the filtering, creating, and determining steps are repeated thus allowing for the system to “reason over time”, continuously updating and learning as new information is received.",Kris Hauser,2019-10-31,https://patentimages.storage.googleapis.com/74/fb/db/d97bc03f81e17a/US10755816.pdf,google patents
