Publication_Number,Title,Abstract,Inventors,Publication_Date,PDF_Link,resource
US20200349434A1,Determining confident data samples for machine learning models on unseen data,"Techniques are provided for determining confident data samples for machine learning (ML) models on unseen data. In one embodiment, a method is provided that comprises extracting, by a system comprising a processor, a feature vector for a data sample based on projection of the data sample onto a standard feature space. The method further comprises processing, by the system, the feature vector using an outlier detection model to determine whether the data sample is within a scope of a training dataset used to train a machine learning model, wherein the outlier detection model was trained using features extracted from the training dataset based on projection of data samples included in the training dataset onto the standard feature space.",Gopal B. Avinash,2020-11-05,https://patentimages.storage.googleapis.com/40/d8/18/cc2afbe0f5282f/US20200349434A1.pdf,google patents
US11610310B2,"Method, apparatus, system, and storage medium for recognizing medical image","The present disclosure describes a method, an apparatus, and storage medium for recognizing medical image. The method includes obtaining, by a device, a medical image. The device includes a memory storing instructions and a processor in communication with the memory. The method further includes determining, by the device, the medical image through a first recognition model to generate a lesion recognition result used for indicating whether the medical image comprises a lesion; and in response to the lesion recognition result indicating that the medical image comprises a lesion, recognizing, by the device, the medical image through a second recognition model to generate a lesion degree recognition result of the medical image used for indicating a degree of the lesion. Manual analysis and customization of a feature extraction solution are not required, so that the efficiency and accuracy of medical image recognition are improved.",Zhongqian SUN,2022-10-27,https://patentimages.storage.googleapis.com/70/57/3e/797a9c0d850edd/US11610310.pdf,google patents
US20190005200A1,Methods and systems for generating a patient digital twin,"Methods and apparatus providing a patient digital twin are disclosed. An example apparatus includes a processor and a memory. The example processor is to configure the memory according to a patient digital twin of a first patient. The example patient digital twin is to include a data structure created from a combination of patient medical record data, image data, genetic information, and historical information, the combination extracted from one or more information systems and arranged in the data structure to form a digital representation of the first patient. The example patient digital twin is to be arranged for query and simulation via the processor. The example patient digital twin is to be combinable with one or more rules to generate, using the processor, a recommendation for a patient health outcome based on modeling the patient digital twin as instructed by the one or more rules.",Chad Dodd,2019-01-03,https://patentimages.storage.googleapis.com/2b/d6/b8/4638fa5a089253/US20190005200A1.pdf,google patents
WO2019088121A1,"Image diagnosis assistance apparatus, data collection method, image diagnosis assistance method, and image diagnosis assistance program","Provided are: an image diagnosis assistance apparatus capable of assisting diagnosis of an endoscopic image captured by an endoscopist; a data collection method; an image diagnosis assistance method; and an image diagnosis assistance program. The image diagnosis assistance apparatus is provided with: a lesion assessment unit that assesses, by a convolutional neural network, the denomination and the position of a lesion which is present in a digestive system endoscopic image of a patient captured by a digestive system endoscopic imaging device and information about accuracies thereof; and a display control unit that performs control for generating an analysis result image in which the denomination and the position of the lesion and the accuracies thereof are displayed and for displaying the image on the digestive system endoscopic image. In the convolutional neural network, learning processing is performed on the basis of the denominations and the positions of the lesions that are present in a plurality of digestive system tumor endoscopic images predetermined by feature extraction of conditions of atrophy, intestinal metaplasia, swelling or depression of a mucous membrane, and mucous membrane color tone.",,2019-05-09,https://patentimages.storage.googleapis.com/7e/57/fe/c99ca899bff56b/WO2019088121A1.pdf,google patents
CN111529063B,Operation navigation system and method based on three-dimensional reconstruction multi-mode fusion,"The invention discloses a multi-modal fusion surgical navigation system and a method based on three-dimensional reconstruction, wherein the system comprises an image data preprocessing module, a preoperative planning module and a real-time surgical navigation module; the image data preprocessing module is used for acquiring and processing medical image data; the preoperative planning module performs multi-mode fusion on the processed medical image data to establish a preoperative lesion location model and plan an operative path; the real-time operation navigation module establishes a dynamic model according to intraoperative four-dimensional ultrasonic scanning data, and compares the dynamic model with a preoperative lesion model to update an operation path; the beneficial effects are as follows: different medical image data are subjected to fusion processing, the advantages of the models are integrated, information complementation is achieved, the dynamic model established in real time is compared with the preoperative focus positioning navigation model in real time, navigation is more accurate, the focus is accurately monitored in the operation implementation process, and therefore the accuracy and the effect of interventional operation treatment are improved.",,2020-08-14,https://patentimages.storage.googleapis.com/f3/6c/51/f615f8b96f8006/CN111529063B.pdf,google patents
US20180261307A1,Secure monitoring of private  encounters,"A method and system for the secure recording, uploading and management of data, audio and video relating to person-to-person encounters to protect both participants from improper behavior in a closed setting, by either party, and to support the rules of digital of evidence in the case of a potential investigation all the while protecting the privacy of the participating parties.",Jesse SLADE SHANTZ,2018-09-13,https://patentimages.storage.googleapis.com/1a/c9/94/80b9ba08ace615/US20180261307A1.pdf,google patents
US11100633B2,Systems and methods for processing real-time video from a medical image device and detecting objects in the video,"The present disclosure relates to systems and methods for processing real-time video and detecting objects in the video. In one implementation, a system is provided that includes an input port for receiving real-time video obtained from a medical image device, a first bus for transferring the received real-time video, and at least one processor configured to receive the real-time video from the first bus, perform object detection by applying a trained neural network on frames of the received real-time video, and overlay a border indicating a location of at least one detected object in the frames. The system also includes a second bus for receiving the video with the overlaid border, an output port for outputting the video with the overlaid border from the second bus to an external display, and a third bus for directly transmitting the received real-time video to the output port.",Giulio EVANGELISTI,2019-12-19,https://patentimages.storage.googleapis.com/49/35/5e/f6cfd59600f7eb/US11100633.pdf,google patents
US11256801B2,Artificial intelligence-based generation of anthropomorphic signatures and use thereof,"The technology disclosed relates to authenticating users using a plurality of non-deterministic registration biometric inputs. During registration, a plurality of non-deterministic biometric inputs are given as input to a trained machine learning model to generate sets of feature vectors. The non-deterministic biometric inputs can include a plurality of face images and a plurality of voice samples of a user. A characteristic identity vector for the user can be determined by averaging feature vectors. During authentication, a plurality of non-deterministic biometric inputs are given as input to a trained machine learning model to generate a set of authentication feature vectors. The sets of feature vectors are projected onto a surface of a hyper-sphere. The system can authenticate the user when a cosine distance between the authentication feature vector and a characteristic identity vector for the user is less than a pre-determined threshold.",Srivatsa Akshay SHARMA,2021-10-21,https://patentimages.storage.googleapis.com/e2/48/4a/261efa6ddb115f/US11256801.pdf,google patents
CN104136500B,The ionomeric polymer composites of organosilicon,"Polymer composite compositions, wherein at least one in each composition is organosilicon ionomer, other composition is polymkeric substance.",,2014-11-05,https://patentimages.storage.googleapis.com/1d/dd/4b/610aec9ec040e9/CN104136500B.pdf,google patents
US11216150B2,Pervasive 3D graphical user interface with vector field functionality,"A three-dimensional graphical user interface (3D GUI) configured to be used by a computer, a display system, an electronic system, or an electro-mechanical system. The 3D GUI provides an enhanced user-engaging experience while enabling a user to manipulate the motion of an object of arbitrary size and a multiplicity of independent degrees of freedom, using sufficient degrees of freedom to represent the motion. The 3D GUI is configured to process the kinematics of objects interacting with vector fields by using the analytics of Stokes' law. The 3D GUI is also configured to process distributed neural networks by methods including combining the actions of individual nodes and storing the result as a T matrix product in a central cluster node.",,2020-12-31,https://patentimages.storage.googleapis.com/44/59/4b/b72489b80a5c2c/US11216150.pdf,google patents
US20210098110A1,Digital Health Wellbeing,"Apparatus and methods include collecting continuously user data from at least one of the mobile device, a user device, a user, or a public records database; identifying one or more symptoms exhibited by the user based at least in part on the collected user data; determining a mental health condition of the user based at least in part on the identified symptoms, a cognitive behavioral therapy information, and a list of diagnoses based on diagnostic and statistical manual of mental disorders; identifying a root cause of the mental health condition based on the collected user data; and recommending by a virtual agent self-help to the user for managing the mental health condition and the root cause during a one-on-one interactive therapy and counseling session.",Hariprasad Periyasamy,2021-04-01,https://patentimages.storage.googleapis.com/d2/de/af/162ad5ca6769b9/US20210098110A1.pdf,google patents
US20200005928A1,System and method for personalized wellness management using machine learning and artificial intelligence techniques,"The disclosure generally relates to a system and method for generating personalized wellness plans for users and monitoring adherence to such plans while providing real-time feedback to users. The personalized wellness plans are generated based on machine learning and/or artificial intelligence techniques and can provide guidance for weight loss, exercise, behavior and lifestyle modification, and integrative health and mindfulness.",,2020-01-02,https://patentimages.storage.googleapis.com/65/c8/46/db06fb505dfab0/US20200005928A1.pdf,google patents
US20190251694A1,Atlas-based segmentation using deep-learning,"Techniques for enhancing image segmentation with the integration of deep learning are disclosed herein. An example method for atlas-based segmentation using deep learning includes: applying a deep learning model to a subject image to identify an anatomical feature, registering an atlas image to the subject image, using the deep learning segmentation data to improve a registration result, generating a mapped atlas, and identifying the feature in the subject image using the mapped atlas. Another example method for training and use of a trained machine learning classifier, in an atlas-based segmentation process using deep learning, includes: applying a deep learning model to an atlas image, training a machine learning model classifier using data from applying the deep learning model, estimating structure labels of areas of the subject image, and defining structure labels by combining the estimated structure labels with labels produced from atlas-based segmentation on the subject image.",Nicolette Patricia Magro,2019-08-15,https://patentimages.storage.googleapis.com/ce/0d/b7/4a1972ab6174b2/US20190251694A1.pdf,google patents
US11699432B2,Cross-context natural language model generation,Provided is a method including obtaining a corpus and an associated set of domain indicators. The method includes learning a set of vectors in an embedding space based on n-grams of the corpus. The method includes updating ontology graphs comprising a set of vertices and edges associating the set of vertices with each other. The method also includes determining a vector cluster using hierarchical clustering based on distances of the set of vectors with respect to each other in the embedding space and determining a hierarchy of the ontology graphs based on a set of domain indicators of a respective set of vertices corresponding to vectors of the vector cluster. The method also includes updating an index based on the ontology graphs.,Unai Garay Maestre,2022-01-06,https://patentimages.storage.googleapis.com/0a/01/49/ed495fd688f7ca/US11699432.pdf,google patents
US8388530B2,Personalized monitoring and healthcare information management using physiological basis functions,"Analysis of individual's serial changes, also referred to as the physiological, pathophysiological, medical or health dynamics, is the backbone of medical diagnosis, monitoring and patient healthcare management. However, such an analysis is complicated by enormous intra-individual and inter-individual variability. To address this problem, a novel serial-analysis method and system based on the concept of personalized basis functions (PBFs) is disclosed. Due to more accurate reference information provided by the PBFs, individual's changes associated with specific physiological activity or a sequence, transition or combination of activities (for example, a transition from sleep to wakefulness and transition from rest to exercise) can be monitored more accurately. Hence, subtle but clinically important changes can be detected earlier than using other methods. A library of individual's PBFs and their transition probabilities (which can be described by Hidden Markov Models) can completely describe individual's physiological dynamics. The system can be adapted for healthcare information management, diagnosis, medical decision support, treatment and side-effect control. It can also be adapted for guiding health, fitness and wellness training, subject identification and more efficient management of clinical trials.",,2011-01-06,https://patentimages.storage.googleapis.com/f5/35/d6/b4738084e37a41/US8388530.pdf,google patents
US7801591B1,Digital healthcare information management,"System for diagnosis, medical decision support, and healthcare information management that performs analysis of serial health data, adapts to the individual data, and represents dynamics of the most significant parameters (indicators), using at least two scales. The system uses the first-scale (low-resolution) analysis of a snapshot measurement of at least one indicator (primary element) such as heart rate or blood pressure and uses a second-scale (higher-resolution) analysis to determine serial changes in each of the said primary elements. The system optimizes information flow, usage of medical knowledge, and improves accuracy of analysis of serial changes, and adaptability to each individual's data. The information can be distributed in parallel to separate databases at different locations.",,2010-09-21,https://patentimages.storage.googleapis.com/d0/b6/b6/3c36ae226891d0/US7801591.pdf,google patents
US8589082B2,"Method for managing obesity, diabetes and other glucose-spike-induced diseases","Disclosed is a method for managing diabetes by reducing the post-prandial blood glucose spike, or the glucose shock. The blood glucose spike, or the glucose shock is reduced by generating a person-specific glucose profile for at least one significant meal to tune or train a blood glucose model (kinetic, artificial intelligence or hybrid), and then using the tuned or the trained model embedded in a computation-capable electronic device to compute and recommend a person-specific meal plan and an exercise plan, including semi-continuous meal ingestion and post-meal exercise while sitting at home or office. Advantages over prior art are that the method uses less strenuous exercise with no or less medicine, is person-specific, quantitative and more suitable for use by an individual, a dietician, or a health care practitioner.",Tapantosh Chakrabarty,2011-02-24,https://patentimages.storage.googleapis.com/50/46/d9/7944cc0456e583/US8589082.pdf,google patents
US20190267128A1,Determining an Optimal Wellness Regime,"A method of determining an optimum wellness regime includes identifying one or more traits—one or more physiological, behavioral and/or biological states of a user; identifying one or more genetic factors and one or more environmental factors of the user that are relevant to one or more of the traits; assigning a weighting to each genetic and/or environmental factor for the traits that defines the likely effect that the genetic and environmental factor has on the traits; calculating a trait score for each trait based on the weightings assigned to each trait; defining a trait profile for the user from the trait scores; and determining, based on the trait profile, a wellness regime that is optimized to the goals of the user.",Stuart GRICE,2019-08-29,https://patentimages.storage.googleapis.com/0f/57/f3/790394e32b7dea/US20190267128A1.pdf,google patents
US11654070B2,Relocation module and methods for surgical equipment,Module for housing electronic and electromechanical medical equipment including a portable digital camera and processing circuitry with machine vision and machine learning software for automatically documenting healthcare events and healthcare equipment operations in the electronic health record.,Susan D. Augustine,2022-11-17,https://patentimages.storage.googleapis.com/c8/bc/6d/b129737328404d/US11654070.pdf,google patents
CN103732201B,Magnetic moxibustion device,"A magnetic moxibustion device comprises a moxibustion canister with a sealed upper end. A moxa cone (5) is hanged in the moxibustion canister through a moxa cone mounting base. The moxa cone mounting base is mounted on a top wall of the moxibustion canister in a detachable manner through a magnetic attraction structure. A magnet guiding needle (3) extending toward a lower end of the moxibustion canister is further disposed in the moxa cone mounting base. The magnet guiding needle (3) passes through the moxa cone (5). The magnetic field of the magnetic attraction structure is guided out of the lower end of the moxibustion canister through the magnet guiding needle (3), and is applied to the human body moxibustion application position, so as to perform the moxibustion therapy and the magnet therapy at the same time. A side wall of the moxibustion canister of the magnetic moxibustion device is provided with several air inlets (7) in peripheral and uniform distribution close to the lower end of the moxibustion canister, and is provided with several air outlets (11) in peripheral and uniform distribution close to the upper end thereof, so that when the magnetic moxibustion device performs moxibustion, the combustion speed of the moxa cone (5) is adjusted through the size of the air outlets, thereby adjusting the temperature and time of the moxibustion.",,2014-04-16,https://patentimages.storage.googleapis.com/70/56/7b/6c26b236d3a7bc/CN103732201B.pdf,google patents
CN102482277B,Epidermal growth factor receptor inhibitor and the method for treating obstacle,"Include novel pyrimidine, pyrrolopyrimidine, pyrrolopyridine, pyridine, purine and the triaizine compounds of the EGF-R ELISA (EGFR) of Her kinases, and this compound the invention discloses a kind of controllable for treating various imbalances, disease or the purposes of symptom.",,2012-05-30,https://patentimages.storage.googleapis.com/eb/b5/f0/b222a0c5b93bc8/CN102482277B.pdf,google patents
AU2011220413B2,Methods and compositions for diagnosis and prognosis of renal injury and renal failure,"The present invention relates to methods and compositions for monitoring, diagnosis, prognosis, and determination of treatment regimens in subjects suffering from or suspected of having a renal injury. In particular, the invention relates to using a plurality of assays configured to detect a kidney injury marker as diagnostic and prognostic biomarkers in renal injuries.",Jeff Gray,2012-09-20,https://patentimages.storage.googleapis.com/22/25/16/ff6ad255adcddd/AU2011220413B2.pdf,google patents
US8118770B2,Reconciling multiple medical device bolus records for improved accuracy,"An electronic device may be configured to prompt a user via an on-board display to measure user glucose via an on-board glucose meter, to compute a first drug bolus value based on the measured user glucose, to display the first drug bolus value on the display and prompt the user via the display to enter carbohydrate information into the device, to compute a second drug bolus value based on the entered carbohydrate information, to display the second drug bolus value on the display and prompt the user via the display to enter user health information into the device, to compute a third drug bolus value based on the entered health information and a total drug bolus value as a sum of the first, second and third drug bolus values, and to display the third and total drug bolus values on the display.",Maury Zivitz,2010-07-01,https://patentimages.storage.googleapis.com/42/c3/c5/9b144bfea02dfb/US8118770.pdf,google patents
CN101309917B,"Inhibitors of the gastric h+, k+-atpase with enhanced therapeutic properties","Chemical syntheses and medical uses of deuterated inhibitors of formula I of the gastric H<+> , K<+ >-ATPase for the treatment and/or management of duodenal ulcers, heartburn, acid reflux, other conditions mediated by gastric acid secretion and/or psoriasis are described.",,2008-11-19,https://patentimages.storage.googleapis.com/d1/69/be/84767b092502b4/CN101309917B.pdf,google patents
US8755897B2,System and method for remote expert-system medical device programming,"One embodiment includes a system for prescribing therapeutic treatment for a patient via communications over a network, including an implantable medical device (IMD) to be implanted in the patient to record a patient characteristic, the implantable medical device being programmable and configured to communicate via wireless communications with the IMD and to communicate securely over the network, the medical device programming computer including a user interface. The embodiment includes a server to communicate securely over the network with the medical device programming computer, the server including at least a first expert prescription system comprising at least one physician's prescription and at least one expert-system to compare the at least one patient characteristic to the at least one physician's prescription to issue a parameter to be programmed into the IMD based on the comparison.",Qingsheng Zhu,2008-03-27,https://patentimages.storage.googleapis.com/6d/50/30/be3a35b275f8f1/US8755897.pdf,google patents
CN101765585B,Antiseptic,"The antimicrobial compound of offer formula (I) of the present invention, and its stereoisomer, pharmaceutically acceptable salt, ester and prodrug；Medical composition comprising these compounds；The method that bacterium infection is treated by administration these compounds；And the method for preparing these compounds.",,2010-06-30,https://patentimages.storage.googleapis.com/38/50/25/3aea3ec6bd2318/CN101765585B.pdf,google patents
US20200286505A1,Method and system for categorizing musical  sound according to emotions,"A computer implemented method for analysing sounds, such as audio tracks, and automatically classifying the sounds in a space in which arousal is one axis and valence is another axis. The location of a sound or track in that arousal-valence space is automatically determined using a computer implemented system that analyses, measures or infers values for each of the following base feature parameters: harmonicity, turbulence, rhythmicity, sharpness, volume and linear harmonic cost, or any combination of two or more of those parameters.",Kit BARNES,2020-09-10,https://patentimages.storage.googleapis.com/f1/2f/26/5c9f52a9181963/US20200286505A1.pdf,google patents
