Publication_Number,Title,Abstract,Inventors,Publication_Date,PDF_Link,resource
EP3985684A1,"Virtualized computing platform for inferencing, advanced processing, and machine learning applications","In various examples, a virtualized computing platform for advanced computing operations - including image reconstruction, segmentation, processing, analysis, visualization, and deep learning - may be provided. The platform may allow for inference pipeline customization by selecting, organizing, and adapting constructs of task containers for local, on-premises implementation. Within the task containers, machine learning models generated off-premises may be leveraged and updated for location specific implementation to perform image processing operations. As a result, and using the virtualized computing platform, facilities such as hospitals and clinics may more seamlessly train, deploy, and integrate machine learning models within a production environment for providing informative and actionable medical information to practitioners.",,2022-04-20,https://patentimages.storage.googleapis.com/c9/8c/09/306adc06b428db/EP3985684A1.pdf,google patents
US11723541B2,"Diagnostic method, method for validation of diagnostic method, and treatment method","A method is disclosed for diagnosing and treating a patient having lesions in both arteries of left and right lower limbs. By determining that a lesion distal to an aortailiac bifurcation is to be treated first, catheters and an operation time can be reduced is to be treated first on a priority basis based on diagnostic data, deciding that a lesion proximal to the bifurcation is to be treated next, then treating the lesions substantially continuously.",Atsushi Nomura,2019-04-25,https://patentimages.storage.googleapis.com/59/c4/8b/4798a2897ff6db/US11723541.pdf,google patents
USRE49710E1,"Systems, methods, and devices for static and dynamic body measurements","In various aspects, embodiments of the disclosure are generally directed to measuring static and dynamic forces of a body using sensors. In particular, a sensor may include a first layer serving as a flexible support material; a second layer on the first layer, the second layer serving as a sensing material; and a third layer on the second layer, the third layer comprising an insulating material. Further, the second layer and the third layer may be coupled using a first electrode comprising a first conductive thread and a first non-conductive thread. Additionally, the first conductive thread may be embedded in the second layer. Also, the first layer and the second layer may be further coupled using a second electrode comprising a second conductive thread and a second non-conductive thread, the second conductive thread may be embedded in the second layer.",,2023-10-24,https://patentimages.storage.googleapis.com/c4/a3/d6/b7a05734a72729/USRE49710.pdf,google patents
KR101818074B1,Artificial intelligence based medical auto diagnosis auxiliary method and system therefor,"Disclosed are an artificial intelligence based automatic medical diagnosis assisting method and a system thereof, which integrate expert analysis with a decision making support system or a computer assisting diagnosis system based on artificial intelligence diagnosis to enhance reliability of a diagnosis result and an automatic medical diagnosis assisting performance of artificial intelligence. The artificial intelligence based automatic medical diagnosis assisting method, performed by a terminal or a computing apparatus making access to a host, comprises the steps of: making the host obtain a first diagnosis result performed based on the artificial intelligence; displaying an image type user interface, including the first diagnosis result, on a screen of the terminal or the computing apparatus; obtaining user inputs including expert diagnosis with respect to the first diagnosis result through the user interface; generating a second diagnosis result on which the user inputs are reflected; and providing the second diagnosis result corresponding to the first diagnosis result to the host.",,2018-01-12,https://patentimages.storage.googleapis.com/20/4c/1d/c2aa18a8b9b897/KR101818074B1.pdf,google patents
CN103976870B,Moxibustion device is pecked in the outstanding moxibustion of a kind of portability smoke evacuation automatic height adjustment walking,"Moxibustion device is pecked in the outstanding moxibustion of a kind of portability smoke evacuation automatic height adjustment walking, belongs to field of medical equipment technology.Corresponding Moxibustion on Acupoints or very low along meridians moxa-moxibustion several acupuncture point a period of time operating process therapeutic efficiency of wasting time and energy to be aimed at by the hand-held Ai Zhu lighted of medical worker with during moxa-moxibustion disease; In a ward during multiple patient Ai Zhu burning a large amount of flue gases be easy to pollute indoor environment to patient and medical worker's health very unfavorable.The technical scheme of this invention is: bracing frame (13) is fixed on gear shaping bar pipe (5), and the slowspeed machine (14) of band gear (12) is fixed on bracing frame (13), and gear (12) engages with band chute lifter rack (6).Its advantage is: use this device to carry out moxibustion treatment time saving and energy saving, free from environmental pollution to patient and medical worker's health very unfavorable.",,2014-08-13,https://patentimages.storage.googleapis.com/95/81/b2/9800c2f8e48b19/CN103976870B.pdf,google patents
US11307892B2,Machine-learning for state determination and prediction,"Without timely reminders, certain individuals may be highly unlikely to complete various tasks scheduled for completion. For example, medicinal therapy regimen patients often have difficulty in remembering to take their prescribed medications in accordance with care provider specified instructions. By providing a reminder prompt generation system that utilizes machine-learning and/or artificial intelligence to determine appropriate reminder times and modalities for providing automated-prompting notifications to users, the users' adherence to scheduled task completions can be significantly increased.",Dominik Dahlem,2020-01-02,https://patentimages.storage.googleapis.com/24/ec/0b/91b52aaa24a10e/US11307892.pdf,google patents
US9754371B2,Multi modality brain mapping system (MBMS) using artificial intelligence and pattern recognition,"A Multimodality Brain Mapping System (MBMS), comprising one or more scopes (e.g., microscopes or endoscopes) coupled to one or more processors, wherein the one or more processors obtain training data from one or more first images and/or first data, wherein one or more abnormal regions and one or more normal regions are identified; receive a second image captured by one or more of the scopes at a later time than the one or more first images and/or first data and/or captured using a different imaging technique; and generate, using machine learning trained using the training data, one or more viewable indicators identifying one or abnormalities in the second image, wherein the one or more viewable indicators are generated in real time as the second image is formed. One or more of the scopes display the one or more viewable indicators on the second image.",Shouleh Nikzad,2016-02-04,https://patentimages.storage.googleapis.com/89/b5/68/e0f47e93b090cb/US9754371.pdf,google patents
US11176669B2,System for remote medical imaging using two conventional smart mobile devices and/or augmented reality (AR),"This invention is a system for remote medical imaging which uses conventional mobile devices (such as two smart phones) and/or augmented reality to calibrate attributes such as the size, color, and shape of a wound, injury, skin lesion, and/or tissue abnormality on a person's body. One of the mobile devices is placed near the wound, injury, skin lesion, and/or tissue abnormality and acts as a digital fiducial marker or color key to help calibrate the size, color, and/or shape of the wound, injury, skin lesion, and/or tissue abnormality.",,2020-10-15,https://patentimages.storage.googleapis.com/7b/ab/a1/4d8d1b63580eda/US11176669.pdf,google patents
US20200381087A1,Systems and methods of clinical trial evaluation,"Systems and methods are configured to match a patient to a clinical trial. A method includes receiving text-based criteria for the clinical trial, including a molecular marker. Additionally, the method includes associating at least a portion of the text-based criteria to one or more pre-defined data fields containing molecular marker information. The method further includes comparing a molecular marker of the patient to the one or more pre-defined data fields, and generating a report for a provider. The report is based on the comparison and includes a match indication of the patient to the clinical trial.",Christopher Paul Tava,2020-12-03,https://patentimages.storage.googleapis.com/9b/65/ce/85636fc7c6df11/US20200381087A1.pdf,google patents
US20170323285A1,Wearable personal digital device for facilitating mobile device payments and personal use,"Provided is a wearable personal digital device for point of healthcare saliva testing. The wearable personal digital device may comprise a processor, a display, biometric sensors, activity tracking sensors, a memory unit, a communication circuit, a housing, an input unit, a projector, a timepiece unit, a haptic touch control actuator, a band, a mounting clip, a saliva sample insert apparatus, a pinhole, a light emitting diode board, a battery, and a set of sensors. The processor may be operable to receive data from an external device, provide a notification to a user based on the data, receive a user input, and perform a command selected based on the user input. The housing may be adapted to enclose the components of the wearable personal digital device. The band may be adapted to attach to the housing and secure the wearable personal digital device on a user body.",,2017-11-07,https://patentimages.storage.googleapis.com/89/80/45/04a6552fdeced3/US20170323285A1.pdf,google patents
US11328807B2,System and method for using artificial intelligence in telemedicine-enabled hardware to optimize rehabilitative routines capable of enabling remote rehabilitative compliance,"A computer-implemented system comprising a treatment apparatus, a patient interface, and a processing device is disclosed. The processing device is configured to receive treatment data pertaining to the user during the telemedicine session, wherein the treatment data comprises one or more characteristics of the user; determine, via one or more trained machine learning models, at least one respective measure of benefit one or more exercise regimens provide the user, wherein the determining the respective measure of benefit is based on the treatment data; determine, via the one or more trained machine learning models, one or more probabilities of the user complying with the one or more exercise regimens; and transmit the treatment plan to a computing device, wherein the treatment plan is generated based on the one or more probabilities and the respective measure of benefit the one or more exercise regimens provide the user.",Daniel Posnack,2021-11-11,https://patentimages.storage.googleapis.com/05/e9/03/429b72214a0edd/US11328807.pdf,google patents
US11636288B2,"Platform, device and process for annotation and classification of tissue specimens using convolutional neural network","Embodiments described herein provide a platform, device and process for digital pathology that enable multi-level annotation and visualization of histopathologic slides using a modular arrangement of deep convolutional neural networks (CNNs). The CNNs can be trained using pathology images (e.g., in some cases increasing the base of data by breaking larger fields of view into smaller ones) to learn features consistent with certain pathologies. The platform can use the CNNs to visually annotate pathology slides at an interface tool of a display device. The platform can automate the process of selection, as well as provide an opportunity for the pathologist to see a depiction of predicted results. The platform can use the CNNs to identify regions of interest on pathology slides. The interface tool can enable a predicted region of interest (ROI) type to be visually presented on a surface map showing the basis of the prediction. If the ROI primarily lands in part of the hyperdimensional space not occupied by any training set, then the interface tool is capable of marking it as an ROI of unknown type.",Zoya VOLYNSKAYA,2020-08-27,https://patentimages.storage.googleapis.com/a0/79/65/598ee7e5aab1bc/US11636288.pdf,google patents
EP3392181A1,A holographic elevator assistance system,"A holographic elevator assistance system (100) mounted in an elevator cab (102). The system (100) includes a holographic display (108) and a Common Passenger Interface Board (CPIB) (116). The CPIB (116) is configured to receive an input, interpret the received input, and perform a projection of a holographic image from the holographic display (108) based on the input.",,2018-10-24,https://patentimages.storage.googleapis.com/47/1a/0c/106180b2f84e1d/EP3392181A1.pdf,google patents
US20210407083A1,System to collect and identify medical conditions from images and expert knowledge,"Systems, methods, and storage media for automatically identifying medical conditions based on images and other data using machine learning methods and algorithms that encode expert knowledge of medical conditions. The systems, methods, and storage media may also leverage infrastructure that facilitates the collection, storage, labeling, dynamic organization, and expert review of existing and incoming data.",Albert Jimenez Sanfiz,2021-12-30,https://patentimages.storage.googleapis.com/9a/f0/05/8c97448e435123/US20210407083A1.pdf,google patents
US11037676B2,Healthcare facility patient and visitor experience management and optimization,"Systems, methods and computer readable media are provided that facilitate managing and optimizing the experience of patients and visitors in association with visiting a medical facility. In an embodiment, as system can include a receiving component that receives arrival data regarding an entity arriving at a healthcare facility. The system can further include a discovery component that determines intent information regarding intent of the entity at the healthcare facility, and analyzes the intent information to determine a destination location for the entity within the healthcare facility, and a wayfinding component that facilitates navigating the entity to the destination location by providing the entity, via a mobile device associated with the entity, with real-time navigation information to the destination location.",David Joseph Sylvan,2019-04-11,https://patentimages.storage.googleapis.com/de/7d/35/9e4f7a1d57348f/US11037676.pdf,google patents
US8571888B2,Real-time image analysis for medical savings plans,"In general terms, embodiments of the present invention relate to methods, apparatuses, and computer program products for providing health or flexible spending account information in association with products identified in an augmented reality environment. In some embodiments, a method is provided that includes: (a) receiving information associated with an image, where the image was captured by a mobile device; (b) determining, based at least partially on the information associated with the image, that the image shows a product that qualifies for purchase under a medical savings plan; and (c) presenting, via the mobile device, information that indicates that the product qualifies for purchase under the medical savings plan.",Erik Stephen Ross,2012-09-13,https://patentimages.storage.googleapis.com/6b/fd/05/ee422b687d299e/US8571888.pdf,google patents
US20210366587A1,System and method for use of treatment device to reduce pain medication dependency,"Systems, methods, and computer-readable mediums for modifying, by an artificial intelligence engine, a treatment plan for optimizing patient outcome and pain levels during treatment sessions. The system includes, in one implementation, a treatment apparatus, a patient interface, and a computing device. The treatment apparatus is configured to be manipulated by a patient while the patient performs the treatment sessions. The computing device is configured to receive the treatment plan for the patient and treatment data pertaining to the patient. The computing device is also configured to receive patient input from the patient interface correlating with the pain levels of the patient. The computing device is further configured to use the treatment plan, the treatment data, and the patient input to generate at least one threshold. Responsive to an occurrence of exceeding the at least one threshold, the computing device is configured to modify the treatment plan.",Daniel Posnack,2021-11-25,https://patentimages.storage.googleapis.com/8c/4c/e6/5ad27705e624f6/US20210366587A1.pdf,google patents
US11240579B2,Sensor systems and methods for characterizing health conditions,"A sensing system comprising a hand-held sensing device with a vibracoustic sensor module (VSM). The VSM comprises a voice coil component comprising a coil holder supporting wire windings; a magnet component comprising a magnet supported by a frame, a magnet gap configured to receive at least a portion of the voice coil component in a spaced and moveable manner; a connector connecting the voice coil component to the magnet component, the connector being compliant and permitting relative movement of the voice coil component and the magnet component; a diaphragm configured to induce a movement of the voice coil component in the magnet gap responsive to incident acoustic waves; a housing for retaining the vibroacoustic sensor module having a handle end and a sensor end, the sensor end having an opening, the VSM positioned such that at least a portion of the diaphragm extends across the opening.",Andreas Schuh,2021-11-11,https://patentimages.storage.googleapis.com/63/2f/8b/0ba5b2eeef466f/US11240579.pdf,google patents
US10998101B1,Health management,A method includes capturing continuously vital signs and motion data from one or more sensors adapted to be coupled to a user; capturing food consumption of the user; predicting a predetermined health condition of the user based on the vital signs; generating a plan for the predetermined health condition; and prompting the user to execute the plan with a closed-loop feedback based on sensor data.,Ha Tran,2021-05-04,https://patentimages.storage.googleapis.com/17/9e/72/0affa9d5577b62/US10998101.pdf,google patents
US20220362350A1,Methods for treating lysosomal acid lipase deficiency in patients,"The present invention provides methods of treating LAL deficiency comprising administering to a mammal a therapeutically effective amount of lysosomal acid lipase with an effective dosage frequency. Methods of improving growth and liver function, increasing LAL tissue concentration, and increasing LAL activity in a human patient suffering from LAL deficiency are also provided.",,2022-11-17,https://patentimages.storage.googleapis.com/59/4d/c4/55d0b8d6636902/US20220362350A1.pdf,google patents
CN113241166B,Method and system for assigning patients and dynamically controlling treatment devices using artificial intelligence,"The present application relates to a method that includes receiving data relating to a user using a treatment device to perform a treatment plan. The data includes characteristics of the user, the treatment plan, and results of the treatment plan. The method includes assigning a user to a queue representing people having similarities to characteristics of the user. The method includes receiving second data relating to a second user, the second data including characteristics of the second user. The method includes determining whether at least some of the features of the second user match at least some of the features of the user, assigning the second user to a first queue, and selecting a treatment plan for the second user via a trained machine learning model, and controlling the treatment device based on the treatment plan while the second user is using the treatment device.",,2021-08-10,https://patentimages.storage.googleapis.com/a9/95/0a/895f6592d3e7cc/CN113241166B.pdf,google patents
US20240013899A1,Health data exchange platform,"The present invention provides systems and methods for exchanging health data. A health data exchange platform includes health data from a plurality of data sources. The health data exchange platform preferably utilizes blockchain technology. The health data exchange platform includes both buyers of health data and suppliers of health data. The health data exchange platform includes a phenotype network system including at least one remote server, a user profile database, a report database, a permissions database, a geographic incident database, and a medical community database.",Todd Youngblood,2024-01-11,https://patentimages.storage.googleapis.com/75/94/ce/bc7e3f7cd64fc3/US20240013899A1.pdf,google patents
US20200294642A1,Methods and systems for a pharmacological tracking and reporting platform,"The present disclosure generally includes methods and systems for recommending a lab test for a patient is disclosed. The method includes obtaining a proposed prescription for the patient from an external data source. The method further includes obtaining patient attributes for the patient, including a diagnosis of the patient. The method also includes determining whether to recommend one or more different lab tests for the patient prior to the patient beginning the proposed prescription based on the proposed prescription and the patient attributes, and providing a testing recommendation to a customer relationship management system, wherein the testing recommendation indicates the one or more different tests that are recommended for the patient in response to determining to recommend one or more different lab tests for the patient, wherein the customer relationship management system transmits the testing recommendation to a healthcare system of a clinic of the patient.",Laura S. Breedlove,2020-09-17,https://patentimages.storage.googleapis.com/78/6b/0a/cd89596b10f6e8/US20200294642A1.pdf,google patents
US20200098461A1,Remotely-executed medical diagnosis and therapy including emergency automation,"Devices, systems, methods, and software for providing remote medical diagnosis and therapy to a subject comprising: a module for conducting telecommunications with a telemedicalist; a module for applying a diagnostic or a therapeutic analysis; an apparatus for dispensing one or more medical items from an inventory of medical items, the inventory of medical items risk profiled to a subject, a population, a venue, or a situation; and optionally, a biosensor apparatus.",Stefanos Poulis,2020-03-26,https://patentimages.storage.googleapis.com/06/c2/05/5cc7051149f109/US20200098461A1.pdf,google patents
US20210046327A1,Real-time patient motion monitoring using a magnetic resonance linear accelerator (mrlinac),"Systems and techniques may be used to estimate a real-time patient state during a radiotherapy treatment using a magnetic resonance linear accelerator (MR-Linac). For example, a method may include generating a dictionary of expanded potential patient measurements and corresponding potential patient states using a preliminary motion model. The method may include training, using a machine learning technique, a correspondence motion model relating an input patient measurement to an output patient state using the dictionary. The method may include estimating, using a processor, the patient state corresponding to a 2D MR image using the correspondence motion model. The method may include directing radiation therapy, using the MR-Linac, to a target according to the patient state.",Martin Emile Lachaine,2021-02-18,https://patentimages.storage.googleapis.com/a1/71/4d/f667bfe770fd01/US20210046327A1.pdf,google patents
US20230241392A1,Obstructive sleep apnea patient programmer for implantable devices,"An implantable neurostimulator system including an electrical lead having formed thereon a pair of bipolar electrodes, the electrical lead is configured for placement of the pair of bipolar electrodes proximate protrusor muscles of a patient. The system also includes a pulse generator electrically connected to the electrical lead and configured to deliver electrical energy to the pair of bipolar electrodes, the pulse generator having mounted therein a sensor configured to detect one or more physiological parameters, a memory, a control circuit, and a telemetry circuit. The system also including a communications telemetry module (CTM) in communication with the telemetry circuit and configured to receive a data collected by the sensor and data related to delivery of electrical energy to the bipolar electrodes, and an external programmer in communication with the CTM and configured to display a user interface the data collected by the sensor and data related to delivery of electrical energy to the bipolar electrodes.",Randal Schulhauser,2023-08-03,https://patentimages.storage.googleapis.com/27/fb/90/9e16140979dc0a/US20230241392A1.pdf,google patents
