Publication_Number,Title,Abstract,Inventors,Publication_Date,PDF_Link,resource
US20230206082A1,Artificial intelligence advisory systems and methods for behavioral pattern matching and language generation,"An artificial intelligence system for behavioral pattern matching and language generation includes at least a server. The system includes a behavior modification module operating on the at least a server, wherein the behavior modification module is designed and configured to receive at least a request for a behavior modification and generate a behavior modification model as a function of the at least a request for behavior modification. The system includes an artificial intelligence advisor operating on the at least a server, wherein the artificial intelligence advisor is configured to receive at least a user input from a user client device, generate at least a textual output using the behavior modification model and the at least a user input, and transmit the at least a textual output to the user client device.",,2023-06-29,https://patentimages.storage.googleapis.com/6e/27/97/07ed7397874aa2/US20230206082A1.pdf,google patents
EP3811845A1,"Method of assisting disease diagnosis based on endoscope image of digestive organ, diagnosis assistance system, diagnosis assistance program, and computer-readable recording medium having said diagnosis assistance program stored thereon","A diagnostic assistance method for a disease based on an endoscopic image of a digestive organ with use of a convolutional neural network (CNN), and the like are provided. A diagnostic assistance method for a disease based on an endoscopic image of a digestive organ with a CNN according to a first embodiment trains the CNN using a first endoscopic image of the digestive organ and at least one final diagnosis result on positivity or negativity to the disease in the digestive organ, a past disease, a severity level, and information corresponding to a site where an image is captured, the final diagnosis result being corresponding to the first endoscopic image, and the trained CNN outputs at least one of a probability of the positivity and/or the negativity to the disease in the digestive organ, a probability of the past disease, a severity level of the disease, an invasion depth of the disease (infiltration depth), and a probability corresponding to the site where the image is captured, based on a second endoscopic image of the digestive organ.",,2021-04-28,https://patentimages.storage.googleapis.com/b1/4a/be/693eaa120bc6ad/EP3811845A1.pdf,google patents
US20210042916A1,Deep learning-based diagnosis and referral of diseases and disorders,"Disclosed herein are systems, methods, devices, and media for carrying out medical diagnosis of diseases and conditions using artificial intelligence or machine learning approaches. Deep learning algorithms enable the automated analysis of medical images such as X-rays to generate predictions of comparable accuracy to clinical experts for various diseases and conditions including those afflicting the lung such as pneumonia.",Rui Hou,2021-02-11,https://patentimages.storage.googleapis.com/0c/1f/68/6b83afdc4bcc2f/US20210042916A1.pdf,google patents
US20120310667A1,Dynamic clinical pathways,Medical professionals diagnose conditions and prescribe treatments or tests based on a process called a clinical pathway. The criteria within the pathway are largely memory-based. The system here manages the process and allows the physician or other health care professional to focus on decision making and patient care using clinical pathways programmed as spheres in a network connected by business rules.,Kenneth ALTMAN,2012-12-06,https://patentimages.storage.googleapis.com/92/03/28/a08862a9c6ac4e/US20120310667A1.pdf,google patents
US20230060039A1,Method and system for using sensors to optimize a user treatment plan in a telemedicine environment,"A method for optimizing at least one exercise for a first user. The method includes receiving first user data including attribute data associated with the first user and outcome data associated with the exercise. The method includes generating, based on the first user data, initial target data. The initial target data is associated with at least one of the first user, the exercise apparatus, and the exercise. The method includes receiving measurement data associated with at least one of the first user, the exercise apparatus, and the exercise. The measurement data is associated with one or more sensors. The method includes determining differential data based on one or more differences between the initial target data and the measurement data. The method includes generating, via an artificial intelligence engine and based on the differential data, a machine learning model trained to generate optimized target data.",,2023-02-23,https://patentimages.storage.googleapis.com/62/b0/60/c1808705a641a0/US20230060039A1.pdf,google patents
EP3394825A1,Platform and system for digital personalized medicine,"The methods and apparatus disclosed herein provide digital diagnostics and digital therapeutics to patients. The digital personalized medicine system uses digital data to assess or diagnose symptoms of a patient, and feedback from the patient response to treatment is considered to update the personalized therapeutic interventions. The methods and apparatus disclosed herein can also diagnose and treat cognitive function of a subject, with fewer questions, decreased amounts of time, and determine a plurality of behavioral, neurological or mental health disorders, and provide clinically acceptable sensitivity and specificity in the diagnosis and treatment.",,2018-10-31,,google patents
WO2020132393A1,A digital platform to identify health conditions and therapeutic interventions using an automatic and distributed artificial intelligence system,"This disclosure is directed to method and system for automatic, distributed, computer-aided, and intelligent data collection/analytics, health monitoring, health condition identification, and patient preventive/remedial health advocacy. The system integrates (1) distributed patient health data collection devices, (2) centralized or distributed data servers running various intelligent and predictive data analytics engines for health screening, assessment, patient health condition identification, and patient preventive/remedial health advocacy, (3) specifically designed data structures including quantized health indicator vectors, patient health condition identification matrices and patient health condition vectors, (4) portal servers configured to interface with (5) distributed physician terminal devices and (6) distributed patient terminal devices for delivering health condition identification, health interventions and patient preventive/remedial health advocacy, and for monitoring and tracking patient activities. The various intelligent and predictive engines are configured to learn and extract hidden features and correlations from a large amount of data obtained from the distributed data collection devices.",,2020-06-25,https://patentimages.storage.googleapis.com/87/24/de/f07639926e24c1/WO2020132393A1.pdf,google patents
US20200117897A1,Adaptive Artificial Intelligence Training Data Acquisition and Plant  Monitoring System,"A system for adapting an in situ wireless sensor network monitoring system to AI analytic trained automated crop or plant monitoring system, by having non-experts with exemplars of watched-for pestilence accumulating wireless sensor image data into identified suspect pest labeled image objects for training AI analytics. Non-experts view and compare suspect pestilence and harms, labeling objects matching exemplars and accumulation a minimum set of training images for training an AI analytic program. Once trained the AI analytic is installed for monitoring for positive identified labeled trained objects identified in sensor data images.",,2020-04-16,https://patentimages.storage.googleapis.com/c0/3c/58/cfc36c5a23f19d/US20200117897A1.pdf,google patents
US20200352441A1,"Efficient Monitoring, Recording, and Analyzing of Physiological Signals","A novel implantable device to reliably record and transmit physiological signals from a subject was described. Design of the device to capture the signals, compress them, transmit via multiple techniques and to interpret the data are shown. Furthermore, the design and operation of the device in a typical setting are taught and the resulting implementation is presented.",Quan Ni,2020-11-12,https://patentimages.storage.googleapis.com/79/e2/ef/3f67f88178479b/US20200352441A1.pdf,google patents
US11443201B2,Artificial intelligence-based self-learning in medical imaging,"For machine learning for a medical imager, results created for individual patients are used to generate the ground truth. The acceptance or change for examining an individual patient is used as the ground truth instead of using a further expert study for the purposes of machine training. In this way, the medical imager creates both samples and ground truth as part of every-day, on-going examinations of patients in the production environment. Machine training is performed based on these samples, and the machine-learned network may then be applied for imaging further patients. For example, the medical imager self-optimizes or self-learns, allowing for updating the machine-learned network more rapidly (e.g., keeping pace with changes in practice in a lower cost and less time-consuming approach and/or updating localized to a practice) in the production environment.",Dorin Comaniciu,2019-11-21,https://patentimages.storage.googleapis.com/9d/d4/7c/f2b0f786ac5881/US11443201.pdf,google patents
CN108766540A,A kind of intelligent medical treatment system,"The invention discloses a kind of intelligent medical treatment system, including remote emergency system, remote emergency system includes medical large database concept, wearable intelligent equipment, mobile intelligent terminal and control centre of hospital；Medical large database concept communicates wirelessly to each other between control centre of hospital and mobile intelligent terminal connect respectively；Wearable intelligent equipment communicates wirelessly to each other between control centre of hospital and mobile intelligent terminal connect respectively；Connection is communicated wirelessly to each other between mobile intelligent terminal and control centre of hospital；It is integrated with a key in wearable intelligent equipment and calls for help module and locating module, intelligent medical treatment APP is installed on mobile intelligent terminal, one key can send out alarm after calling for help module triggering by intelligent medical treatment APP control mobile intelligent terminals, it is sent an SOS simultaneously to hospital by control centre of hospital, the position of patient can be accurately positioned in hospital and family numbers of patients by positioning system, timely succoured convenient for reaching the offer of patient position in time.",,2018-11-06,https://patentimages.storage.googleapis.com/80/8c/d4/e96e64f6a6786c/CN108766540A.pdf,google patents
CN102272325B,Methods and compositions of molecular profiling for disease diagnostics,"The present invention relates to compositions, kits, and methods for molecular profiling and cancer diagnostics, including but not limited to gene expression product markers, alternative exon usage markers, and DNA polymorphisms associated with cancer. In particular, the present invention provides molecular profiles associated with thyroid cancer, methods of determining the molecular profiles, and methods of analyzing results to provide a diagnosis.",,2011-12-07,https://patentimages.storage.googleapis.com/8a/33/3e/82570ad6826aa2/CN102272325B.pdf,google patents
WO2017117150A1,Machine learning system for creating and utilizing an assessment metric based on outcomes,"A machine learning system and method utilizing artificial intelligence improves the provisioning of healthcare and reduces the total cost of healthcare and lost productivity. The approach creates a quantifiable assessment of quality and a ranking number measuring a provider's quality of healthcare services. The machine learning system makes a determination of quality based on a clinical evaluation database, an employee related time and attendance database, and a costing database. The system analyzes how quickly a provider returns an employee to work at or near pre-absence productivity and at what cost. The system creates a ranking number that provides employees with a comparison of providers. Employees may then be incentivized to seek high value providers.",,2017-07-06,https://patentimages.storage.googleapis.com/7b/ce/8c/851a06c0dad768/WO2017117150A1.pdf,google patents
CN109285605A,A kind of medical diagnosis system and diagnostic method based on artificial intelligence,"The invention discloses a kind of medical diagnosis systems based on artificial intelligence, it is diagnosed in conjunction with tcm diagnosis and doctor trained in Western medicine, its tcm diagnosis passes through picture recognition module, speech recognition module, four methods of diagnosis when pulse transducer and electronic nose simulation Chinese medicinal interrogation obtain patient condition's information, combine dialectical theoretical progress illness dialectical by Chinese medicine data processing unit simultaneously, realize the diagnosis to patient, and provide therapeutic scheme, the diagnosis of its doctor trained in Western medicine obtains the illness information in patient's readme by speech recognition module, and determine its problem place, and it provides corresponding scope of examination inventory and patient is made to carry out next step inspection, and the diagnostic result of patient is obtained according to the fruit combined data library content that comes to an end, to provide corresponding therapeutic scheme, diagnostic system of the invention can make patient self selective Chinese medicine or western medical treatment according to demand, and two kinds are controlled Treatment mode can simulate expert and accurately and reliably be diagnosed, and valuable treatment time is saved for patient.",,2019-01-29,https://patentimages.storage.googleapis.com/86/72/7d/22395a577ea0d9/CN109285605A.pdf,google patents
US11557387B2,Artificial intelligence robot and method of controlling the same,"An artificial intelligence (AI) robot includes a body for defining an exterior appearance and containing a medicine to be discharged according to a medication schedule, a support, an image capture unit for capturing an image within a traveling zone to create image information, and a controller for discharging the medicine to a user according to the medication schedule, reading image data of the user to determine whether the user has taken the medicine, and reading image data and biometric data of the user after the medicine-taking to determine whether there is abnormality in the user. The AI robot identifies a user and discharges a medicine matched with the user, so as to prevent errors. The AI robot detects a user's reaction after medicine-taking through a sensor, and performs deep learning, etc. to learn the user's reaction, to determine an emergency situation, etc. and cope with a result of the determination.",,2020-12-31,https://patentimages.storage.googleapis.com/a7/80/12/18c8f8134f8f1d/US11557387.pdf,google patents
CN116606261A,KRAS G12C inhibitors and methods of use thereof,"The present application relates to KRASG12C inhibitors and methods of use thereof. Provided herein are benzisothiazoles, isothiazolo [3,4-b ] pyridines, quinazolines, phthalazines, pyrido [2,3-d ] pyridazines and pyrido [2,3-d ] pyrimidine derivatives and related compounds as KRASG12C inhibitors for the treatment of, for example, lung cancer, pancreatic cancer or colorectal cancer.",,2023-08-18,https://patentimages.storage.googleapis.com/a5/a2/c6/85962dab64b220/CN116606261A.pdf,google patents
US20220270759A1,Methods and systems for an artificial intelligence alimentary professional support network for vibrant constitutional guidance,"A system for an artificial intelligence alimentary professional support network for vibrant constitutional guidance includes a computing device. The system includes a diagnostic engine designed and configured to receive a biological extraction from a user and generate a diagnostic output based on the biological extraction. The system includes an advisor module designed and configured to receive a request for an advisory input, generate an advisory output using the request for an advisory input and the diagnostic output, and transmit the advisory output. The system includes an alimentary input module designed and configured to receive the advisory output, select an informed advisor alimentary professional client device as a function of the request for an advisory input, and transmit the at least an advisory output to the informed advisor alimentary professional client device.",,2022-08-25,https://patentimages.storage.googleapis.com/20/8d/64/09aa856c9d5089/US20220270759A1.pdf,google patents
US20210327595A1,"Systems and methods for tracking and managing infectious diseases while maintaining privacy, anonymity and confidentiality of data","Embodiments of the present invention provide an artificial intelligence-enabled apparatus, such as a mobile communication device equipped with input ports and bio sensors and executing controlling, coordinating, managing software algorithms for reducing the spread of a pandemic and for managing social and economic impacts to minimize disruptions that occur due to indiscriminate and global actions such as strict social distancing and business closures. User information is maintained private and secure, and can be used to detect and warn about potentially dangerous situations, such as a user being in close proximity to potentially infected individuals.",,2021-10-21,https://patentimages.storage.googleapis.com/8f/96/4d/e7aee462de96e1/US20210327595A1.pdf,google patents
US20220328189A1,"Systems, methods, and apparatuses for implementing advancements towards annotation efficient deep learning in computer-aided diagnosis",Embodiments described herein include systems for implementing annotation-efficient deep learning in computer-aided diagnosis. Exemplary embodiments include systems having a processor and a memory specially configured with instructions for learning annotation-efficient deep learning from non-labeled medical images to generate a trained deep-learning model by applying a multi-phase model training process via specially configured instructions for pre-training a model by executing a one-time learning procedure using an initial annotated image dataset; iteratively re-training the model by executing a fine-tuning learning procedure using newly available annotated images without re-using any images from the initial annotated image dataset; selecting a plurality of most representative samples related to images of the initial annotated image dataset and the newly available annotated images by executing an active selection procedure based on the which of a collection of un-annotated images exhibit either a greatest uncertainty or a greatest entropy; extracting generic image features; updating the model using the generic image features extrated; and outputting the model as the trained deep-learning model for use in analyzing a patient medical image. Other related embodiments are disclosed.,Jianming Liang,2022-10-13,https://patentimages.storage.googleapis.com/f1/9a/e3/09f400d9e7529e/US20220328189A1.pdf,google patents
CN109346169A,"A kind of artificial intelligence assisting in diagnosis and treatment system and its construction method, equipment and storage medium","The invention discloses a kind of artificial intelligence assisting in diagnosis and treatment system and its construction methods, equipment and storage medium, belong to life and health technical field.It includes disease knowledge map module, diagnosing model module and machine learning decision-making module；Wherein, the disease knowledge map module forms disease knowledge library, for collecting the various resources about disease for inquiring and reading；The diagnosing model module, for receiving patient information, it stores information in system database, and input to machine learning decision-making module, achievement data is extracted from disease knowledge map module by machine learning decision-making module to compare and analyze, it is pushed out patient information collection, the scheme collection for prompting inspection and associated medication therapies that sufferer needs to implement is selected for doctor.The bottom knowledge mapping that it is based on is comprehensive, authoritative；There are easy to operate, service efficiency height in interaction；In human-computer interaction level, intelligence degree is high.",,2019-02-15,https://patentimages.storage.googleapis.com/14/1f/f1/0b18d7120e3d0d/CN109346169A.pdf,google patents
CN110910976A,"Medical record detection method, device, equipment and storage medium","The application relates to the field of artificial intelligence, and provides a medical record detection method, a device, equipment and a storage medium, wherein the method comprises the following steps: acquiring a plurality of pieces of patient information to be processed and a medical record label corresponding to each piece of patient information; inputting a plurality of pieces of patient information into a standardized model, and outputting the plurality of pieces of patient information into standard patient information stored in a database through the standardized model; training a neural network model by taking Key, Query and Value as input and taking Attention Value as output so as to obtain a trained neural network model; the Key is medicine information and personal basic information; inputting target patient information into the trained neural network model, and outputting a target medical record label according to the target patient information through the trained neural network model; and sending the target medical record label to the terminal. By the method, whether misdiagnosis exists in the medical record of the patient is judged.",,2020-03-24,https://patentimages.storage.googleapis.com/2e/d3/01/a60e494a4a52f6/CN110910976A.pdf,google patents
CN110249392A,Intelligent assisting in diagnosis and treatment system and method,"The present invention provides a kind of intelligent assisting in diagnosis and treatment system, comprising: receiving module, for receiving case history；Categorization module, for the case history received to be carried out classification processing according to disease type, and by sorted medical records storage to corresponding database；Matching module obtains the medical record templates that match degree is greater than the preset threshold, wherein medical record templates storage disease type and illness information corresponding with disease type for matching case history with the medical record templates in medical record templates library；Secondary diagnostic module, matched disease type and illness information corresponding with disease type for obtaining, corresponding historical diagnostic reference scheme is provided using artificial intelligence convolutional neural networks learning method, and the matched disease type of institute and illness information corresponding with disease type are exported, for doctor's reference.Example of the present invention solves in current medical and health services, and the medical level of doctor not only can be improved, and effectively reduces the misdiagnosis rate of doctor in the horizontal insufficient problem of doctor.",,2019-09-17,https://patentimages.storage.googleapis.com/c9/68/91/ab45d58004a5c3/CN110249392A.pdf,google patents
US20220054092A1,"Eyewear with health assessment, risk monitoring and recovery assistance","Electronic eyewear configured to provide health condition or health risk monitoring or guidance to its user. Electronic eyewear, when being worn, is conveniently positioned to provide health condition or health risk monitoring. The eyewear can include various detectors for monitoring health conditions. The eyewear can also monitor the geographic location of the eyewear, which can impact risk level to the user. The eyewear can also measure distance to other persons for risk monitoring and/or facilitating contact tracing. The eyewear can serve to alert its user or facilitate alerting others. The user of the eyewear can configure a risk profile so that the eyewear provides customized health condition or health risk monitoring. Other embodiments can assist a user who is ill, such as, for example, by monitoring their health, monitoring for particular illnesses, tracking worsening conditions, and/or providing guidance to the user.",C. Douglass Thomas,2022-02-24,https://patentimages.storage.googleapis.com/34/bf/4e/3c16c74bcff15d/US20220054092A1.pdf,google patents
